<?xml version="1.0" encoding="UTF-8"?>
<!DOCTYPE empresa SYSTEM "ejercicio6.dtd">
<empresa cif="B98419327">
    <razon_social>Canoas Mauricio</razon_social>
    <pagina_web>www.canoasmauricio.es</pagina_web>
    <sucursal>
        <codigo_sucursal>777</codigo_sucursal>
        <nombre_sucursal>Sucursal Centro</nombre_sucursal>
        <direccion>
            <calle>Calle Mayor, 10</calle>
            <codigo_postal>28001</codigo_postal>
            <poblacion>Madrid</poblacion>
        </direccion>
        <telefonos>
            <telefono tipo="fijo">91232123</telefono>
            <telefono tipo="movil">611608761</telefono>
        </telefonos>
    </sucursal>
    <tickets>
        <ticket>
            <numero_ticket>0001</numero_ticket>
            <fecha>2024-11-14</fecha>
            <hora>10:00</hora>
            <empleado>Juan Pérez</empleado>
            <lineas_ticket>
                <linea_ticket>
                    <cantidad>2</cantidad>
                    <codigo_articulo>001</codigo_articulo>
                    <descripcion_articulo>Bolígrafo azul</descripcion_articulo>
                    <precio_unitario>1.50</precio_unitario>
                    <importe>3.00</importe>
                </linea_ticket>
                <linea_ticket>
                    <cantidad>1</cantidad>
                    <codigo_articulo>002</codigo_articulo>
                    <descripcion_articulo>Cuaderno A4</descripcion_articulo>
                    <precio_unitario>3.00</precio_unitario>
                    <importe>3.00</importe>
                </linea_ticket>
                <linea_ticket>
                    <cantidad>1</cantidad>
                    <codigo_articulo>003</codigo_articulo>
                    <descripcion_articulo>Calculadora</descripcion_articulo>
                    <precio_unitario>10.00</precio_unitario>
                    <importe>10.00</importe>
                </linea_ticket>
            </lineas_ticket>
            <resumen>
                <forma_pago tipo="efectivo">efectivo</forma_pago>
                <importe_total>16.00</importe_total>
            </resumen>
        </ticket>
        <ticket>
            <numero_ticket>0002</numero_ticket>
            <fecha>2024-11-14</fecha>
            <hora>11:00</hora>
            <empleado>Ana López</empleado>
            <lineas_ticket>
                <linea_ticket>
                    <cantidad>1</cantidad>
                    <codigo_articulo>001</codigo_articulo>
                    <descripcion_articulo>Bolígrafo azul</descripcion_articulo>
                    <precio_unitario>1.50</precio_unitario>
                    <importe>1.50</importe>
                </linea_ticket>
                <linea_ticket>
                    <cantidad>2</cantidad>
                    <codigo_articulo>002</codigo_articulo>
                    <descripcion_articulo>Cuaderno A4</descripcion_articulo>
                    <precio_unitario>3.00</precio_unitario>
                    <importe>6.00</importe>
                </linea_ticket>
                <linea_ticket>
                    <cantidad>1</cantidad>
                    <codigo_articulo>004</codigo_articulo>
                    <descripcion_articulo>Grapadora</descripcion_articulo>
                    <precio_unitario>5.00</precio_unitario>
                    <importe>5.00</importe>
                </linea_ticket>
            </lineas_ticket>
            <resumen>
                <forma_pago tipo="tarjeta">tarjeta</forma_pago>
                <importe_total>12.50</importe_total>
            </resumen>
        </ticket>
    </tickets>
</empresa>